<?xml version="1.0" encoding="UTF-8"?>
<!--
  XSD for PicodroidManifest.xml.

  Mirrors buildSrc/src/main/kotlin/picodroid/ManifestSchema.kt, which is the
  authoritative validator at build time — this schema is for editor / IDE
  validation and autocomplete only and is NOT wired into the build (the
  "exactly one entry point" rule is already enforced there).

  The one-of-three constraint uses an XSD 1.1 xs:assert, so validate with a
  1.1-aware tool (IntelliJ / Android Studio, or a Xerces/Saxon-based checker).
  Existing manifests without an xsi:schemaLocation stay valid; the reference is
  opt-in per file.
-->
<xs:schema xmlns:xs="http://www.w3.org/2001/XMLSchema"
           xmlns:vc="http://www.w3.org/2007/XMLSchema-versioning"
           vc:minVersion="1.1"
           elementFormDefault="unqualified">

  <xs:element name="manifest">
    <xs:complexType>
      <xs:all>
        <xs:element name="application" type="ApplicationType" minOccurs="1" maxOccurs="1"/>
        <!-- The logical size the app lays out against. The runtime shows the app at exactly
             that size on every panel: centred and letterboxed on a larger one, panned on a
             smaller one. Absent: the app resizes to the panel. -->
        <xs:element name="supports-screens" type="SupportsScreensType" minOccurs="0" maxOccurs="1"/>
        <!-- A hardware feature the app uses (PackageManager.FEATURE_* names). With
             required="true" the installer refuses the app on a board that lacks it;
             the default is not required. -->
        <xs:element name="uses-feature" type="UsesFeatureType" minOccurs="0" maxOccurs="unbounded"/>
      </xs:all>
      <!-- App package id, e.g. "helloworld" or "com.acme.app". Required. -->
      <xs:attribute name="package" type="xs:string" use="required"/>
      <!-- Optional; a blank/absent version defaults to "1.0" at build time. -->
      <xs:attribute name="version" type="xs:string" use="optional"/>
      <!-- Optional monotonic integer version (defaults to 1); a newer build of
           the same package must carry a greater code. -->
      <xs:attribute name="version-code" type="xs:positiveInteger" use="optional"/>
    </xs:complexType>
  </xs:element>

  <!--
    The entry point: exactly one of main-class / activity / application names
    the class the runtime launches (the short form), or the Android form
    declares the components as children and the <activity> with the MAIN
    intent filter (else the first) is the entry.
  -->
  <xs:complexType name="ApplicationType">
    <xs:choice minOccurs="0" maxOccurs="unbounded">
      <xs:element name="activity" type="ActivityType"/>
      <xs:element name="service" type="ComponentType"/>
      <!-- A BroadcastReceiver the framework starts for the boot-time actions its
           intent-filter names (BOOT_COMPLETED, TIME_SET, TIMEZONE_CHANGED), or
           that an explicit broadcast Intent reaches; the other actions are heard
           by receivers registered at run time only. -->
      <xs:element name="receiver" type="ActivityType"/>
      <!-- Read and ignored: nothing enforces a permission on this platform. -->
      <xs:element name="uses-permission" type="ComponentType"/>
    </xs:choice>
    <xs:attribute name="main-class" type="xs:string" use="optional"/>
    <xs:attribute name="activity" type="xs:string" use="optional"/>
    <xs:attribute name="application" type="xs:string" use="optional"/>
    <!-- Display name a launcher shows; defaults to the package name. -->
    <xs:attribute name="label" type="xs:string" use="optional"/>
    <!-- App icon: the name of a PNG under assets/ (48x48 recommended). -->
    <xs:attribute name="icon" type="xs:string" use="optional"/>
    <!-- The style that is the app's theme (@style/Name), applied before the
         first Activity's onCreate; absent, the style called AppTheme. The build
         reads this as android:theme too; the prefixed spelling is not modelled
         here (no namespace), so a schema-validated manifest writes "theme". -->
    <xs:attribute name="theme" type="xs:string" use="optional"/>
    <xs:assert test="count(@main-class | @activity | @application) = 1 or count(activity) >= 1"/>
  </xs:complexType>

  <!-- A declared component: name (android:name at build time) is the class,
       dotted, slash-form or relative to the manifest package (".Main"). -->
  <xs:complexType name="ComponentType">
    <xs:attribute name="name" type="xs:string" use="required"/>
  </xs:complexType>

  <xs:complexType name="ActivityType">
    <xs:sequence>
      <xs:element name="intent-filter" minOccurs="0" maxOccurs="unbounded">
        <xs:complexType>
          <xs:choice minOccurs="0" maxOccurs="unbounded">
            <xs:element name="action" type="ComponentType"/>
            <xs:element name="category" type="ComponentType"/>
          </xs:choice>
        </xs:complexType>
      </xs:element>
    </xs:sequence>
    <xs:attribute name="name" type="xs:string" use="required"/>
    <!-- An <activity>'s title (android:label at build time): literal text, what
         Activity.getTitle and an action bar start with; absent, the application's
         label. -->
    <xs:attribute name="label" type="xs:string" use="optional"/>
  </xs:complexType>

  <xs:complexType name="SupportsScreensType">
    <xs:attribute name="design-width" type="xs:positiveInteger" use="required"/>
    <xs:attribute name="design-height" type="xs:positiveInteger" use="required"/>
  </xs:complexType>

  <xs:complexType name="UsesFeatureType">
    <!-- e.g. picodroid.hardware.touchscreen, picodroid.hardware.wifi, picodroid.hardware.ethernet -->
    <xs:attribute name="name" type="xs:string" use="required"/>
    <xs:attribute name="required" type="xs:boolean" use="optional" default="false"/>
  </xs:complexType>

</xs:schema>
